{"$id":"https://aurora.invalid/schemas/v6_preservation_manifest_v1","$schema":"https://json-schema.org/draft/2020-12/schema","additionalProperties":false,"properties":{"maximum_archive_bytes":{"minimum":1,"type":"integer"},"maximum_compression_ratio":{"minimum":1,"type":"integer"},"maximum_member_count":{"minimum":1,"type":"integer"},"maximum_total_uncompressed_bytes":{"minimum":1,"type":"integer"},"part_size_bytes":{"minimum":1,"type":"integer"},"preservation_manifest_digest":{"minLength":1,"pattern":"^sha256:[0-9a-f]{64}$","type":"string"},"schema_version":{"const":"v6_preservation_manifest_v1","minLength":1,"type":"string"},"source_archive_digest":{"minLength":1,"type":"string"},"source_artifact_id":{"minimum":1,"type":"integer"},"source_artifact_name":{"minLength":1,"type":"string"},"source_expires_at_utc":{"minLength":1,"type":"string"},"source_repository":{"const":"trading-optimizer-lab-org/aurora","minLength":1,"type":"string"},"source_run_id":{"minimum":1,"type":"integer"},"source_size_bytes":{"minimum":1,"type":"integer"}},"required":["schema_version","source_repository","source_run_id","source_artifact_id","source_artifact_name","source_size_bytes","source_archive_digest","source_expires_at_utc","maximum_archive_bytes","maximum_member_count","maximum_total_uncompressed_bytes","maximum_compression_ratio","part_size_bytes","preservation_manifest_digest"],"title":"v6_preservation_manifest_v1","type":"object"}
