{"maximum_archive_bytes":2000000000,"maximum_compression_ratio":200,"maximum_member_count":500000,"maximum_total_uncompressed_bytes":50000000000,"part_size_bytes":1992294400,"preservation_manifest_digest":"sha256:294099e4b60982d536f526435ba4b8cf25ca3e6c8466ceab9ccd22a3bad116f4","schema_version":"v6_preservation_manifest_v1","source_archive_digest":"sha256:870ab8a0ded260b7761b7c706c239c4fce712d2fd7f7c8fb1d41dc1dffedda5b","source_artifact_id":8251391531,"source_artifact_name":"global-technical-buy-indicator-long-hold-fast-strict-v6-results","source_expires_at_utc":"2026-08-10T18:16:37Z","source_repository":"trading-optimizer-lab-org/aurora","source_run_id":29162930823,"source_size_bytes":1962204087}
